Kim Jong-nam killing: Regime critic carried 'antidote',http://www.bbc.com/news/world-asia-42186034
North Korea's missile and nuclear programme,http://www.bbc.com/news/world-asia-41174689
North Korea's missile test,http://www.bbc.com/news/av/world-asia-42171557/north-korea-s-missile-test
North Korea: US urges all nations to cut ties,http://www.bbc.com/news/world-asia-42176042
North Korea: What could tip the balance,http://www.bbc.com/news/world-asia-42176552
Beijing’s balancing act over North Korea,http://www.bbc.com/news/world-asia-china-41236742
North Korea crisis in 300 words,http://www.bbc.com/news/world-asia-40871848
Major fishing nations agree Arctic moratorium,http://www.bbc.com/news/world-42205184
Climate change: US report at odds with some in Trump team,http://www.bbc.com/news/world-us-canada-41868878
Cod and haddock 'may vanish' from Scotland's west coast,http://www.bbc.com/news/uk-scotland-highlands-islands-41816878
Russia country profile,http://www.bbc.com/news/world-europe-17839672
Trump-Russia: Flynn's dealings were 'lawful',http://www.bbc.com/news/world-us-canada-42209758
Trump-Russia inquiry: US leader says 'no collusion',http://www.bbc.com/news/av/world-us-canada-42210175/trump-russia-inquiry-us-leader-says-no-collusion
Michael Flynn: What next for Trump-Russia investigation?,http://www.bbc.com/news/av/world-us-canada-42161103/michael-flynn-what-next-for-trump-russia-investigation
Russian FM: Haley’s North Korea statement ‘bloodthirsty’,https://www.washingtonpost.com/world/europe/russian-fm-haleys-north-korea-statement-bloodthirsty/2017/12/01/f6b61b02-d6de-11e7-9ad9-ca0619edfa05_story.html
The Latest: Seoul: New ICBM has range to reach Washington,https://www.washingtonpost.com/world/asia_pacific/the-latest-germany-said-to-recall-a-diplomat-in-north-korea/2017/11/30/5f7c312a-d631-11e7-9ad9-ca0619edfa05_story.html
Why North Korea’s latest ballistic missile test is worrisome,https://www.washingtonpost.com/news/checkpoint/wp/2017/11/30/why-north-koreas-latest-ballistic-missile-test-is-worrisome/
The Latest: Russia opposes further isolation of North Korea,https://www.washingtonpost.com/world/asia_pacific/the-latest-russias-un-ambassador-urges-nkorea-restraint/2017/11/29/85f9ce2c-d567-11e7-9ad9-ca0619edfa05_story.html
Hawaii tests nuclear alarms as North Korea threat escalates,https://www.washingtonpost.com/national/hawaii-tests-nuclear-alarms-as-north-korea-threat-escalates/2017/12/01/8853a876-d6a9-11e7-b62d-d9345ced896d_story.html
"Global warming sage pens novel of Vermont, ‘resistance’",https://www.washingtonpost.com/entertainment/global-warming-sage-pens-novel-of-vermont-resistance/2017/11/19/bede602e-cd4f-11e7-a87b-47f14b73162a_story.html
"The Energy 202: Trump expected to sign bill calling climate change a ""direct threat."" Really.",https://www.washingtonpost.com/news/powerpost/paloma/the-energy-202/2017/11/28/the-energy-202-trump-expected-to-sign-defense-bill-calling-climate-change-a-direct-threat-really/5a1c3d0b30fb0469e883f85f/
"Sea life beneath Antarctic ice shelf is changing, and warming may be why",https://www.washingtonpost.com/national/health-science/sea-life-beneath-antarctic-ice-shelf-is-changing-and-warming-may-be-why/2017/11/24/035c4866-cee4-11e7-9d3a-bcbe2af58c3a_story.html
"After ditching Paris, Trump’s team has another big international climate decision to make",https://www.washingtonpost.com/news/energy-environment/wp/2017/11/22/after-ditching-paris-trumps-team-has-another-big-international-climate-decision-to-make/
Satellite images show extent of air pollution worldwide,https://www.washingtonpost.com/world/asia_pacific/satellite-images-show-extent-of-air-pollution-worldwide/2017/12/01/10178cba-d695-11e7-9ad9-ca0619edfa05_story.html
Warming to make thunderstorms larger and more frequent,https://www.washingtonpost.com/politics/warming-to-make-thunderstorms-larger-and-more-frequent/2017/11/20/6f489df6-ce60-11e7-a87b-47f14b73162a_story.html
"Sweeping aside Russia probe, Trump says ‘we’re unbeatable’",https://www.washingtonpost.com/national/sweeping-aside-russia-probe-trump-says-were-unbeatable/2017/12/02/c1ea469e-d799-11e7-9ad9-ca0619edfa05_story.html
Top FBI official assigned to Mueller’s Russia probe said to have been removed after sending anti-Trump texts,https://www.washingtonpost.com/world/national-security/two-senior-fbi-officials-on-clinton-trump-probes-exchanged-politically-charged-texts-disparaging-trump/2017/12/02/9846421c-d707-11e7-a986-d0a9770d9a3e_story.html
"Trump, reacting to Flynn guilty plea, says there’s been ‘absolutely no collusion’ with Russia",https://www.washingtonpost.com/politics/trump-reacting-to-flynn-guilty-plea-says-theres-been-absolutely-no-collusion-with-russia/2017/12/02/9ada7768-d76c-11e7-9ad9-ca0619edfa05_story.html
Key events in Michael Flynn’s interactions with Russia,https://www.washingtonpost.com/politics/federal_government/key-events-in-michael-flynns-interactions-with-russia/2017/12/01/feef4412-d6f5-11e7-9ad9-ca0619edfa05_story.html
Is Russia covering up a nuclear accident?,https://www.washingtonpost.com/opinions/is-russia-covering-up-a-nuclear-accident/2017/12/01/0e75ac86-cfcc-11e7-a1a3-0d1e45a6de3d_story.html
